{
  "$schema": "https://json-schema.org/draft/2020-12/schema",
  "$id": "https://local-pii.dev/schemas/cli/batch-redact-report/1.0.0",
  "title": "Bounded batch redaction report",
  "description": "Privacy-safe aggregate manifest for one strict bounded recursive rules-only redaction attempt. Paths, names, values, source text, patterns, and per-file digests are excluded.",
  "schemaVersion": "1.0.0",
  "type": "object",
  "additionalProperties": false,
  "required": ["schemaVersion", "operation", "outcome", "completionPolicy", "detectorBundleVersion", "policy", "manifest", "selection", "limits"],
  "properties": {
    "schemaVersion": { "const": "1.0.0" },
    "operation": { "const": "BATCH_REDACT" },
    "outcome": { "enum": ["SUCCEEDED", "PARTIAL", "FAILED"] },
    "completionPolicy": { "const": "REQUIRE_COMPLETE" },
    "detectorBundleVersion": { "type": "string", "minLength": 1, "maxLength": 100 },
    "policy": { "$ref": "https://local-pii.dev/schemas/cli/cli-report/1.0.0#/$defs/policySummary" },
    "manifest": {
      "type": "object",
      "additionalProperties": false,
      "required": ["complete", "selectedFileCount", "publishedFileCount", "failedFileCount", "directoryCount", "entryCount", "totalInputBytes", "processedInputBytes", "publishedOutputBytes", "replacementCount", "byEntity", "failuresByCode"],
      "properties": {
        "complete": { "type": "boolean" },
        "selectedFileCount": { "type": "integer", "minimum": 0, "maximum": 1000 },
        "publishedFileCount": { "type": "integer", "minimum": 0, "maximum": 1000 },
        "failedFileCount": { "type": "integer", "minimum": 0, "maximum": 1000 },
        "directoryCount": { "type": "integer", "minimum": 1, "maximum": 1000 },
        "entryCount": { "type": "integer", "minimum": 0, "maximum": 10000 },
        "totalInputBytes": { "type": "integer", "minimum": 0, "maximum": 268435456 },
        "processedInputBytes": { "type": "integer", "minimum": 0, "maximum": 268435456 },
        "publishedOutputBytes": { "type": "integer", "minimum": 0, "maximum": 1073741824 },
        "replacementCount": { "type": "integer", "minimum": 0, "maximum": 1000000000 },
        "byEntity": {
          "type": "object",
          "propertyNames": { "$ref": "https://local-pii.dev/schemas/common/entity-type/1.0.0" },
          "additionalProperties": { "type": "integer", "minimum": 1, "maximum": 1000000000 }
        },
        "failuresByCode": {
          "type": "object",
          "propertyNames": {
            "enum": [
              "CONTRACT_UNSUPPORTED", "SCHEMA_INVALID", "IDEMPOTENCY_CONFLICT", "INPUT_TOO_LARGE",
              "FORMAT_UNSUPPORTED", "FORMAT_ENCRYPTED", "FORMAT_CORRUPT", "POLICY_UNSATISFIABLE",
              "POLICY_REVIEW_REQUIRED", "POLICY_BLOCKED", "REQUIRED_DETECTOR_UNAVAILABLE", "MODEL_UNAVAILABLE",
              "DETECTOR_TIMEOUT", "DETECTION_LIMIT_EXCEEDED", "MODEL_OUTPUT_INVALID", "SOURCE_MAP_INVALID",
              "REDACTION_PLAN_CONFLICT", "REDACTION_COUNT_MISMATCH", "VERIFICATION_RESIDUAL",
              "VERIFICATION_INCOMPLETE", "FIDELITY_OUT_OF_RANGE", "ARTIFACT_DIGEST_MISMATCH",
              "STORAGE_UNAVAILABLE", "JOB_CONFLICT", "OUTPUT_COLLISION", "RATE_LIMITED",
              "SUPPLY_CHAIN_INVALID", "AUTHORIZATION_DENIED", "OPERATION_CANCELLED", "INTERNAL_ERROR"
            ]
          },
          "additionalProperties": { "type": "integer", "minimum": 1, "maximum": 1000 }
        }
      }
    },
    "selection": {
      "type": "object",
      "additionalProperties": false,
      "required": ["includePatternCount", "excludePatternCount"],
      "properties": {
        "includePatternCount": { "type": "integer", "minimum": 1, "maximum": 32 },
        "excludePatternCount": { "type": "integer", "minimum": 0, "maximum": 32 }
      }
    },
    "limits": {
      "type": "object",
      "additionalProperties": false,
      "required": ["maximumFiles", "maximumDirectories", "maximumEntries", "maximumTotalInputBytes", "maximumRelativePathCodeUnits", "maximumPatternMatchSteps", "timeoutMs"],
      "properties": {
        "maximumFiles": { "const": 1000 },
        "maximumDirectories": { "const": 1000 },
        "maximumEntries": { "const": 10000 },
        "maximumTotalInputBytes": { "const": 268435456 },
        "maximumRelativePathCodeUnits": { "const": 8192 },
        "maximumPatternMatchSteps": { "const": 100000000 },
        "timeoutMs": { "type": "integer", "minimum": 1000, "maximum": 300000 }
      }
    }
  },
  "allOf": [
    {
      "if": { "properties": { "outcome": { "const": "SUCCEEDED" } } },
      "then": { "properties": { "manifest": { "type": "object", "additionalProperties": true, "properties": { "complete": { "const": true }, "failedFileCount": { "const": 0 }, "failuresByCode": { "type": "object", "additionalProperties": true, "maxProperties": 0 } } } } }
    },
    {
      "if": { "properties": { "outcome": { "const": "PARTIAL" } } },
      "then": { "properties": { "manifest": { "type": "object", "additionalProperties": true, "properties": { "complete": { "const": false }, "publishedFileCount": { "type": "integer", "minimum": 1 }, "failedFileCount": { "type": "integer", "minimum": 1 }, "failuresByCode": { "type": "object", "additionalProperties": true, "minProperties": 1 } } } } }
    },
    {
      "if": { "properties": { "outcome": { "const": "FAILED" } } },
      "then": { "properties": { "manifest": { "type": "object", "additionalProperties": true, "properties": { "complete": { "const": false }, "publishedFileCount": { "const": 0 }, "failedFileCount": { "type": "integer", "minimum": 1 }, "failuresByCode": { "type": "object", "additionalProperties": true, "minProperties": 1 } } } } }
    }
  ],
  "examples": [{
    "schemaVersion": "1.0.0", "operation": "BATCH_REDACT", "outcome": "SUCCEEDED",
    "completionPolicy": "REQUIRE_COMPLETE", "detectorBundleVersion": "0.2.0",
    "policy": { "id": "development-labels", "version": "0.1.0", "digest": "sha256:cccccccccccccccccccccccccccccccccccccccccccccccccccccccccccccccc", "riskTier": "LOW", "example": true },
    "manifest": { "complete": true, "selectedFileCount": 1, "publishedFileCount": 1, "failedFileCount": 0, "directoryCount": 1, "entryCount": 1, "totalInputBytes": 32, "processedInputBytes": 32, "publishedOutputBytes": 24, "replacementCount": 1, "byEntity": { "EMAIL": 1 }, "failuresByCode": {} },
    "selection": { "includePatternCount": 5, "excludePatternCount": 0 },
    "limits": { "maximumFiles": 1000, "maximumDirectories": 1000, "maximumEntries": 10000, "maximumTotalInputBytes": 268435456, "maximumRelativePathCodeUnits": 8192, "maximumPatternMatchSteps": 100000000, "timeoutMs": 60000 }
  }]
}
